{
  "action_contract": "action_contract.json",
  "clinical_validation": false,
  "clinician_review_status": "not_submitted",
  "duration_s": 8.0,
  "frame_count": 161,
  "frames": [
    {
      "action": [
        0.0,
        0.0,
        0.0,
        0.0,
        0.0,
        0.0,
        1.0,
        0.0,
        0.0,
        0.0,
        0.0,
        0.0,
        0.0,
        1.0
      ],
      "phase": "rest",
      "timestamp_s": 0.0
    },
    {
      "action": [
        9.265e-05,
        -4.633e-05,
        0.00011581,
        2.316e-05,
        0.0,
        -2.316e-05,
        1.0,
        -9.265e-05,
        -4.633e-05,
        0.00011581,
        -2.316e-05,
        0.0,
        2.316e-05,
        1.0
      ],
      "phase": "rest",
      "timestamp_s": 0.05
    },
    {
      "action": [
        0.0006848,
        -0.0003424,
        0.000856,
        0.0001712,
        0.0,
        -0.0001712,
        1.0,
        -0.0006848,
        -0.0003424,
        0.000856,
        -0.0001712,
        0.0,
        0.0001712,
        1.0
      ],
      "phase": "rest",
      "timestamp_s": 0.1
    },
    {
      "action": [
        0.00212895,
        -0.00106447,
        0.00266119,
        0.00053224,
        0.0,
        -0.00053224,
        1.0,
        -0.00212895,
        -0.00106447,
        0.00266119,
        -0.00053224,
        0.0,
        0.00053224,
        1.0
      ],
      "phase": "rest",
      "timestamp_s": 0.15
    },
    {
      "action": [
        0.0046336,
        -0.0023168,
        0.005792,
        0.0011584,
        0.0,
        -0.0011584,
        1.0,
        -0.0046336,
        -0.0023168,
        0.005792,
        -0.0011584,
        0.0,
        0.0011584,
        1.0
      ],
      "phase": "rest",
      "timestamp_s": 0.2
    },
    {
      "action": [
        0.00828125,
        -0.00414063,
        0.01035156,
        0.00207031,
        0.0,
        -0.00207031,
        1.0,
        -0.00828125,
        -0.00414063,
        0.01035156,
        -0.00207031,
        0.0,
        0.00207031,
        1.0
      ],
      "phase": "rest",
      "timestamp_s": 0.25
    },
    {
      "action": [
        0.0130464,
        -0.0065232,
        0.016308,
        0.0032616,
        0.0,
        -0.0032616,
        1.0,
        -0.0130464,
        -0.0065232,
        0.016308,
        -0.0032616,
        0.0,
        0.0032616,
        1.0
      ],
      "phase": "rest",
      "timestamp_s": 0.3
    },
    {
      "action": [
        0.01881355,
        -0.00940677,
        0.02351694,
        0.00470339,
        0.0,
        -0.00470339,
        1.0,
        -0.01881355,
        -0.00940677,
        0.02351694,
        -0.00470339,
        0.0,
        0.00470339,
        1.0
      ],
      "phase": "rest",
      "timestamp_s": 0.35
    },
    {
      "action": [
        0.0253952,
        -0.0126976,
        0.031744,
        0.0063488,
        0.0,
        -0.0063488,
        1.0,
        -0.0253952,
        -0.0126976,
        0.031744,
        -0.0063488,
        0.0,
        0.0063488,
        1.0
      ],
      "phase": "rest",
      "timestamp_s": 0.4
    },
    {
      "action": [
        0.03254985,
        -0.01627493,
        0.04068731,
        0.00813746,
        0.0,
        -0.00813746,
        1.0,
        -0.03254985,
        -0.01627493,
        0.04068731,
        -0.00813746,
        0.0,
        0.00813746,
        1.0
      ],
      "phase": "rest",
      "timestamp_s": 0.45
    },
    {
      "action": [
        0.04,
        -0.02,
        0.05,
        0.01,
        0.0,
        -0.01,
        1.0,
        -0.04,
        -0.02,
        0.05,
        -0.01,
        0.0,
        0.01,
        1.0
      ],
      "phase": "rest",
      "timestamp_s": 0.5
    },
    {
      "action": [
        0.04745015,
        -0.02372508,
        0.05931269,
        0.01186254,
        0.0,
        -0.01186254,
        1.0,
        -0.04745015,
        -0.02372508,
        0.05931269,
        -0.01186254,
        0.0,
        0.01186254,
        1.0
      ],
      "phase": "rest",
      "timestamp_s": 0.55
    },
    {
      "action": [
        0.0546048,
        -0.0273024,
        0.068256,
        0.0136512,
        0.0,
        -0.0136512,
        1.0,
        -0.0546048,
        -0.0273024,
        0.068256,
        -0.0136512,
        0.0,
        0.0136512,
        1.0
      ],
      "phase": "rest",
      "timestamp_s": 0.6
    },
    {
      "action": [
        0.06118645,
        -0.03059323,
        0.07648306,
        0.01529661,
        0.0,
        -0.01529661,
        1.0,
        -0.06118645,
        -0.03059323,
        0.07648306,
        -0.01529661,
        0.0,
        0.01529661,
        1.0
      ],
      "phase": "rest",
      "timestamp_s": 0.65
    },
    {
      "action": [
        0.0669536,
        -0.0334768,
        0.083692,
        0.0167384,
        0.0,
        -0.0167384,
        1.0,
        -0.0669536,
        -0.0334768,
        0.083692,
        -0.0167384,
        0.0,
        0.0167384,
        1.0
      ],
      "phase": "rest",
      "timestamp_s": 0.7
    },
    {
      "action": [
        0.07171875,
        -0.03585937,
        0.08964844,
        0.01792969,
        0.0,
        -0.01792969,
        1.0,
        -0.07171875,
        -0.03585937,
        0.08964844,
        -0.01792969,
        0.0,
        0.01792969,
        1.0
      ],
      "phase": "rest",
      "timestamp_s": 0.75
    },
    {
      "action": [
        0.0753664,
        -0.0376832,
        0.094208,
        0.0188416,
        0.0,
        -0.0188416,
        1.0,
        -0.0753664,
        -0.0376832,
        0.094208,
        -0.0188416,
        0.0,
        0.0188416,
        1.0
      ],
      "phase": "rest",
      "timestamp_s": 0.8
    },
    {
      "action": [
        0.07787105,
        -0.03893552,
        0.09733881,
        0.01946776,
        0.0,
        -0.01946776,
        1.0,
        -0.07787105,
        -0.03893552,
        0.09733881,
        -0.01946776,
        0.0,
        0.01946776,
        1.0
      ],
      "phase": "rest",
      "timestamp_s": 0.85
    },
    {
      "action": [
        0.0793152,
        -0.0396576,
        0.099144,
        0.0198288,
        0.0,
        -0.0198288,
        1.0,
        -0.0793152,
        -0.0396576,
        0.099144,
        -0.0198288,
        0.0,
        0.0198288,
        1.0
      ],
      "phase": "rest",
      "timestamp_s": 0.9
    },
    {
      "action": [
        0.07990735,
        -0.03995367,
        0.09988419,
        0.01997684,
        0.0,
        -0.01997684,
        1.0,
        -0.07990735,
        -0.03995367,
        0.09988419,
        -0.01997684,
        0.0,
        0.01997684,
        1.0
      ],
      "phase": "rest",
      "timestamp_s": 0.95
    },
    {
      "action": [
        0.08,
        -0.04,
        0.1,
        0.02,
        0.0,
        -0.02,
        1.0,
        -0.08,
        -0.04,
        0.1,
        -0.02,
        0.0,
        0.02,
        1.0
      ],
      "phase": "approach",
      "timestamp_s": 1.0
    },
    {
      "action": [
        0.08003474,
        -0.03997684,
        0.10004633,
        0.02002316,
        2.316e-05,
        -0.02002316,
        1.0,
        -0.08003474,
        -0.03997684,
        0.10004633,
        -0.02002316,
        -2.316e-05,
        0.02002316,
        1.0
      ],
      "phase": "approach",
      "timestamp_s": 1.05
    },
    {
      "action": [
        0.0802568,
        -0.0398288,
        0.1003424,
        0.0201712,
        0.0001712,
        -0.0201712,
        1.0,
        -0.0802568,
        -0.0398288,
        0.1003424,
        -0.0201712,
        -0.0001712,
        0.0201712,
        1.0
      ],
      "phase": "approach",
      "timestamp_s": 1.1
    },
    {
      "action": [
        0.08079836,
        -0.03946776,
        0.10106448,
        0.02053224,
        0.00053224,
        -0.02053224,
        1.0,
        -0.08079836,
        -0.03946776,
        0.10106448,
        -0.02053224,
        -0.00053224,
        0.02053224,
        1.0
      ],
      "phase": "approach",
      "timestamp_s": 1.15
    },
    {
      "action": [
        0.0817376,
        -0.0388416,
        0.1023168,
        0.0211584,
        0.0011584,
        -0.0211584,
        1.0,
        -0.0817376,
        -0.0388416,
        0.1023168,
        -0.0211584,
        -0.0011584,
        0.0211584,
        1.0
      ],
      "phase": "approach",
      "timestamp_s": 1.2
    },
    {
      "action": [
        0.08310547,
        -0.03792969,
        0.10414063,
        0.02207031,
        0.00207031,
        -0.02207031,
        1.0,
        -0.08310547,
        -0.03792969,
        0.10414063,
        -0.02207031,
        -0.00207031,
        0.02207031,
        1.0
      ],
      "phase": "approach",
      "timestamp_s": 1.25
    },
    {
      "action": [
        0.0848924,
        -0.0367384,
        0.1065232,
        0.0232616,
        0.0032616,
        -0.0232616,
        1.0,
        -0.0848924,
        -0.0367384,
        0.1065232,
        -0.0232616,
        -0.0032616,
        0.0232616,
        1.0
      ],
      "phase": "approach",
      "timestamp_s": 1.3
    },
    {
      "action": [
        0.08705508,
        -0.03529661,
        0.10940678,
        0.02470339,
        0.00470339,
        -0.02470339,
        1.0,
        -0.08705508,
        -0.03529661,
        0.10940678,
        -0.02470339,
        -0.00470339,
        0.02470339,
        1.0
      ],
      "phase": "approach",
      "timestamp_s": 1.35
    },
    {
      "action": [
        0.0895232,
        -0.0336512,
        0.1126976,
        0.0263488,
        0.0063488,
        -0.0263488,
        1.0,
        -0.0895232,
        -0.0336512,
        0.1126976,
        -0.0263488,
        -0.0063488,
        0.0263488,
        1.0
      ],
      "phase": "approach",
      "timestamp_s": 1.4
    },
    {